ID,Category,Question,Choice1,Choice2,Choice3,Choice4,Explanation
1,相続,相続税の基礎控除額は？,3000万円＋600万円×法定相続人数,3000万円＋500万円×法定相続人数,5000万円,一律3000万円,相続税の基礎控除は「3000万円＋600万円×法定相続人数」。
2,ライフプランニング,老齢基礎年金の受給資格期間は原則何年以上？,10年以上,5年以上,20年以上,25年以上,老齢基礎年金は原則として受給資格期間が10年以上必要。
3,リスク管理,地震による火災の損害は、火災保険だけで補償される？,原則補償されない（地震保険が必要）,火災保険で補償される,自動車保険で補償される,家財保険で自動的に補償される,地震・噴火・津波による損害は火災保険では原則補償されず、地震保険等が必要。
4,金融資産運用,市場金利が上昇すると、固定利付債券の価格はどうなる？,下落する,上昇する,変わらない,満期まで上がり続ける,金利上昇局面では既発の固定利付債の相対的魅力が下がるため価格は下落しやすい。
5,タックスプランニング,所得税の税率構造はどれ？,超過累進税率,定率税率,逆進税率,一律税率,所得税は課税所得が大きいほど高い税率が適用される超過累進税率。
6,不動産,不動産取引の重要事項説明を行い、記名できるのは誰？,宅地建物取引士,不動産鑑定士,行政書士,売主（一般個人）,重要事項説明は宅地建物取引士が行い、説明書面に記名する。
7,金融資産運用,新NISAの年間投資枠（つみたて投資枠＋成長投資枠）の合計上限は？,360万円,120万円,240万円,480万円,新NISAは「つみたて投資枠120万円＋成長投資枠240万円」で年間合計360万円。
8,ライフプランニング,健康保険の被扶養者（扶養に入っている家族）の保険料負担は原則どうなる？,被扶養者は保険料を個別に負担しない,被扶養者は国民健康保険料を支払う,被扶養者も同額の保険料を支払う,被扶養者は保険料を半額負担する,健康保険では被扶養者は原則として個別の保険料負担がない。
9,リスク管理,iDeCo（個人型確定拠出年金）の掛金の税制上の扱いは？,掛金は全額が所得控除（小規模企業共済等掛金控除）,配当控除の対象になる,医療費控除の対象になる,雑損控除の対象になる,iDeCoの掛金は全額が所得控除（小規模企業共済等掛金控除）として扱われる。
10,相続,相続の承認または放棄の熟慮期間は原則いつまで？,自己のために相続開始を知った時から3か月以内,1か月以内,6か月以内,1年以内,相続の承認・放棄は原則として「相続開始を知った時から3か月以内（熟慮期間）」。
11,相続,相続税の申告・納付期限は原則いつまで？,相続開始を知った日の翌日から10か月以内,相続開始を知った日の翌日から3か月以内,相続開始を知った日の翌日から6か月以内,相続開始を知った日の翌日から1年以内,相続税の申告・納付は「相続の開始を知った日の翌日から10か月以内」が原則。
12,相続,配偶者の相続税の税額軽減（配偶者控除）で非課税となる取得財産の上限は？,1億6千万円または法定相続分相当額のいずれか多い金額,1億円まで,3,000万円まで,法定相続分の50%まで
13,タックスプランニング,贈与税（暦年課税）の基礎控除は？,110万円,60万円,100万円,120万円,暦年課税の贈与税は、1年間の贈与額から基礎控除110万円を差し引いて計算する。
14,タックスプランニング,所得税の最高税率（国税・復興特別所得税は除外）は？,45%,40%,50%,55%,所得税（国税）は超過累進税率で、最高税率は45%。
15,金融資産運用,新NISAの年間投資枠（つみたて投資枠＋成長投資枠の合計）は？,360万円,240万円,120万円,480万円,新NISAは「つみたて120万円＋成長240万円」で、年間合計360万円まで投資できる。
16,金融資産運用,新NISAの生涯非課税保有限度額（総枠）は？,1800万円,1200万円,2000万円,3600万円,新NISAの生涯非課税保有限度額（総枠）は1800万円。
17,リスク管理,地震保険は単独で加入できる？,できない（火災保険とセットで加入）,できる（地震保険だけで加入できる）,生命保険とセットで加入,自動車保険とセットで加入,地震保険は火災保険に付帯して加入する仕組みで、単独加入はできない。
18,リスク管理,自賠責保険の補償対象として正しいものは？,対人賠償（相手の死傷）,対物賠償（相手の車や物）,自分の車両損害,搭乗者傷害（同乗者のケガ）だけ,自賠責保険は原則として対人賠償（相手の死傷）を補償し、対物は対象外。
19,不動産,固定資産税の納税義務者は原則だれ？,賦課期日（1月1日）現在の固定資産課税台帳上の所有者,1月31日現在の所有者,不動産会社（仲介業者）,実際の利用者（居住者）,固定資産税は賦課期日（原則1月1日）時点の台帳上の所有者に課税される。
20,ライフプランニング,老齢基礎年金の受給開始年齢（原則）は？,65歳,60歳,62歳,70歳,老齢基礎年金は原則65歳から受給開始。
21,相続,遺留分が認められない相続人は？,兄弟姉妹,配偶者,子,直系尊属,遺留分は配偶者や子や直系尊属に認められるが兄弟姉妹には認められない。
22,タックスプランニング,医療費控除の対象となりやすい費用は？,治療目的の医薬品代,健康診断で異常がなかった費用,美容目的の施術費,予防接種の全額,医療費控除は治療目的の支出が対象となる。
23,金融資産運用,分散投資の主な効果は？,価格変動リスクの低減,必ず利益が出る,税金がかからなくなる,元本が保証される,値動きの異なる資産に分けることで全体の変動を抑えやすくなる。
24,金融資産運用,株式投資における配当利回りの計算として正しいのは？,1株当たり配当金を株価で割る,株価を1株当たり配当金で割る,配当金を利益で割る,利益を株価で割る,配当利回りは配当金と株価の関係を示す指標である。
25,リスク管理,定期保険と比べた終身保険の特徴は？,一生涯の保障がある,保険料が必ず安い,満期で必ず返戻金がある,一定期間のみ保障される,終身保険は保障が一生涯続く点が特徴である。
26,リスク管理,個人賠償責任保険が役立つ事故の例は？,自転車で他人にけがをさせた,自分の病気による入院,自分の車の修理,火災による自宅の損害,日常生活で他人に損害を与えた賠償責任に備える保険である。
27,ライフプランニング,家計の固定費に分類されやすい支出は？,家賃,外食費,旅行費,交際費,固定費は毎月ほぼ一定額で発生する支出である。
28,ライフプランニング,キャッシュフロー表の主な目的は？,将来の収入と支出を時系列で把握する,税金を計算する,投資商品の利回りを比較する,保険金額を決める,将来の家計収支を見通すために作成される。
29,不動産,不動産の所有権移転を第三者に主張するために必要なのは？,登記,売買契約書,代金の支払い,鍵の引き渡し,不動産の権利変動は登記を備えることで第三者に対抗できる。
30,不動産,不動産取得税が課税されるのは原則いつ？,不動産を取得したとき,登記をしたとき,売買契約を結んだとき,固定資産税を払うとき,不動産取得税は不動産を取得したことに対して課税される。
31,ライフプランニング,国民年金の加入対象として正しいものはどれ？,原則として日本国内に住む20歳以上60歳未満の人,原則として日本国内に住む18歳以上65歳未満の人,原則として日本国内に住む25歳以上60歳未満の人,原則として日本国内に住む20歳以上70歳未満の人,国民年金は原則として日本国内に住む20歳以上60歳未満の人が加入対象です。
32,金融資産運用,投資信託の基準価額の計算として正しいものはどれ？,純資産総額を受益権口数で割ったもの,純資産総額に信託報酬を足したもの,購入時手数料を差し引いたもの,分配金を加算したもの,基準価額は原則として純資産総額÷受益権口数で算出されます。
33,リスク管理,地震による損害を補償する保険に関する説明として正しいものはどれ？,地震保険は火災保険に付帯して加入する,地震保険は自動車保険に付帯して加入する,地震保険は単独で必ず加入しなければならない,地震による火災損害は火災保険だけで必ず補償される,地震保険は原則として火災保険とセットで付帯加入します。
34,不動産,建ぺい率の計算として正しいものはどれ？,建築面積÷敷地面積×100,延べ面積÷敷地面積×100,敷地面積÷建築面積×100,延べ面積÷建築面積×100,建ぺい率は敷地面積に対する建築面積の割合です。
35,相続,配偶者と子が相続人である場合の法定相続分として正しいものはどれ？,配偶者2分の1で子2分の1,配偶者3分の2で子3分の1,配偶者4分の3で子4分の1,配偶者1で子0,配偶者と子が相続人の場合は配偶者が2分の1で子が2分の1です。
36,タックスプランニング,所得税の課税方式として正しいものはどれ？,超過累進税率,比例税率,定額税率,逆進税率,所得税は課税所得が増えるほど税率が高くなる超過累進税率です。
37,金融資産運用,分散投資の主な目的として正しいものはどれ？,リスクを低減する,必ず利益を増やす,元本を法律上保証する,手数料を必ず下げる,分散投資は価格変動リスクを抑えることを目的とします。
38,リスク管理,地震保険について正しいものはどれ？,地震保険は火災保険なしで単独加入できない,地震保険は保険期間が必ず1年である,地震保険はどの損害でも時価を超えて支払われる,地震保険はすべての建物で補償内容が自由に決められる,地震保険は原則として火災保険に付帯する形で加入します。
39,ライフプランニング,傷病手当金について正しいものはどれ？,業務外の病気やけがで働けないときに支給される,業務上の病気やけがのみ支給される,退職後は一切受け取れない,支給は必ず賃金の全額である,傷病手当金は業務外の病気やけがで就労できない場合に健康保険から支給されます。
40,タックスプランニング,確定申告の申告期限として原則正しいものはどれ？,翌年3月15日,翌年2月15日,当年12月31日,翌年4月30日,所得税の確定申告は原則として翌年3月15日が期限です。
41,相続,相続の承認に関する説明として正しいものはどれ？,相続放棄は原則として自己のために相続開始を知った時から3か月以内に家庭裁判所へ申述する,相続放棄は相続開始からいつでも自由にできる,相続放棄は口頭で相続人全員に伝えれば成立する,相続放棄は被相続人の生前に必ず行う,相続放棄は原則として相続開始を知った時から3か月以内に家庭裁判所へ申述します。
42,不動産,不動産登記に関する説明として正しいものはどれ？,所有権移転登記は第三者に対抗するために重要である,登記をしなくても第三者に常に対抗できる,登記簿の記載はすべて現況と必ず一致する,登記は市区町村役場で行う,登記は第三者に権利を主張（対抗）するために重要な役割を持ちます。
43,金融資産運用,株式の配当金に関する説明として正しいものはどれ？,配当金は原則として会社の利益処分により支払われる,配当金は必ず毎月支払われる,配当金は株価が上がったときだけ支払われる,配当金は国が保証する,配当金は会社の利益や剰余金の配分（利益処分等）として支払われます。
44,タックスプランニング,給与所得控除に関する説明として正しいものはどれ？,給与所得者の必要経費の代わりとして一定額を控除する,給与所得者は実額経費を必ず全額控除できる,給与所得控除は事業所得者だけが使える,給与所得控除は住民税には一切影響しない,給与所得控除は給与所得者の概算経費として所得から控除されます。
45,ライフプランニング,厚生年金保険の被保険者区分として正しいものはどれ？,会社員や公務員などが加入する,自営業者のみが加入する,20歳以上の全国民が必ず単独で加入する,学生のみが加入する,厚生年金は主に会社員や公務員などが加入する年金制度です。
46,リスク管理,自動車保険の対人賠償保険に関する説明として正しいものはどれ？,他人を死傷させた損害賠償を補償する,自分の車の修理費のみを補償する,自分のけがのみを補償する,地震による車両損害を必ず補償する,対人賠償保険は他人の死傷に対する損害賠償責任を補償します。
47,金融資産運用,債券投資の価格変動要因として正しいものはどれ？,市場金利が上昇すると一般に債券価格は下落する,市場金利が上昇すると一般に債券価格は上昇する,市場金利と債券価格は無関係である,債券価格は発行時以外変動しない,債券価格は金利と逆方向に動く関係が基本です。
48,不動産,借地借家法に関する説明として正しいものはどれ？,建物賃貸借は借主保護の規定がある,建物賃貸借は常に貸主の意思だけで更新拒絶できる,借地借家法は土地の売買だけを規定する,借地借家法は住宅ローンを規定する,借地借家法は賃借人（借主）保護の考え方が強い法律です。
49,タックスプランニング,住民税の所得割に関する説明として正しいものはどれ？,前年の所得を基準に課税される,当年の所得を基準に毎月確定する,相続財産だけを基準に課税される,納税者が任意に税率を決められる,住民税の所得割は原則として前年の所得を基準に計算されます。
50,ライフプランニング,老齢基礎年金の受給開始年齢として原則正しいものはどれ？,65歳,60歳,70歳,62歳,老齢基礎年金は原則として65歳から受給開始です。
51,相続,死亡保険金の相続税の非課税枠は？,500万円×法定相続人数,3000万円＋600万円×法定相続人数,500万円×受取人の人数,一律500万円,死亡保険金には相続税の非課税枠として500万円×法定相続人数がある。
52,相続,法定相続人が配偶者と子2人の場合の法定相続分は？,配偶者2分の1で子は各4分の1,配偶者3分の2で子は各6分の1,配偶者4分の3で子は各8分の1,配偶者2分の1で子は各2分の1,配偶者と子が相続人のときは配偶者2分の1で残りを子で等分する。
53,ライフプランニング,キャッシュフロー表で示すものは？,一定期間の収入支出と貯蓄残高の推移,保険商品の保障内容の一覧,資産配分比率の一覧,税率と税額の一覧,将来の家計の収入支出と資金残高の見通しを時系列で示す。
54,リスク管理,定期保険の一般的な特徴は？,保険期間が一定で満期保険金はない,一生涯保障が続く,解約返戻金が必ず多い,貯蓄性が最も高い,定期保険は一定期間の保障に特化し満期保険金がないのが一般的。
55,金融資産運用,市場金利が上昇したとき一般に債券価格はどうなる？,下落する,上昇する,変わらない,必ず額面に戻る,金利上昇局面では既発債の利回りが相対的に低くなるため価格は下落しやすい。
56,金融資産運用,投資信託の基準価額の考え方として正しいものは？,純資産総額を総口数で割ったもの,運用会社の利益を足したもの,購入時の価格を固定したもの,分配金の合計額,基準価額は投資信託の純資産総額を受益権口数で割って算出する。
57,不動産,不動産登記の一般的な性質として正しいものは？,公信力はない,公信力がある,登記がなくても第三者に対抗できる,登記簿は私文書である,不動産登記には公信力がなく真の権利関係を必ず保証するものではない。
58,不動産,元利均等返済の一般的な特徴は？,毎回の返済額が一定,毎回の元金返済額が一定,返済初期は元金割合が高い,総返済額は必ず少ない,元利均等は返済額が一定で初期は利息割合が大きく元金の減りが遅い。
59,タックスプランニング,所得控除と税額控除の違いとして正しいものは？,所得控除は課税所得を減らし税額控除は税額を直接減らす,所得控除は税額を直接減らし税額控除は課税所得を減らす,どちらも税額を直接減らす,どちらも課税所得を増やす,所得控除は税率をかける前の所得を減らし税額控除は計算後の税額を減らす。
60,タックスプランニング,総合課税の対象となる所得として一般的に該当するものは？,給与所得,譲渡所得のうち株式等の譲渡所得,利子所得,退職所得,給与所得は総合課税の代表例として他の所得と合算して税額計算する。
61,相続,相続税の課税価格に加算される生前贈与の対象期間は原則何年？,3年,5年,7年,10年,相続開始前に行われた贈与のうち一定期間内の贈与は相続税の計算上で持ち戻して課税価格に加算します。FP3の基本ルールでは原則として相続開始前3年以内の贈与が対象です。対象となる贈与がある場合は受贈者が相続人かどうかなど細部の論点が出ますがまずは3年が基準である点を押さえます。
62,相続,法定相続人が配偶者と子2人の場合の法定相続分は？,配偶者2分の1と子は各4分の1,配偶者3分の2と子は各6分の1,配偶者4分の3と子は各8分の1,配偶者2分の1と子は各3分の1,相続人が配偶者と子の場合は配偶者が2分の1で子全体が2分の1です。子が複数いるときは子の取り分を人数で等分します。したがって子2人なら子の合計2分の1を2人で分けて各4分の1になります。計算は配偶者と子の基本パターンとして頻出です。
63,保険,生命保険契約で契約者と被保険者が同一で受取人が相続人の場合に相続税となるのはどれ？,死亡保険金,満期保険金,解約返戻金,医療給付金,契約者が保険料を負担し被保険者が死亡したことで支払われる死亡保険金は相続税の課税対象になります。理由は被保険者の死亡を原因として相続人等が受け取る経済的利益だからです。満期保険金や解約返戻金は生存中の給付で所得税等の論点になりやすく税目の切り分けが重要です。
64,保険,損害保険の保険料を個人が支払った場合に一般に必要経費になるのはどれ？,事業用資産にかけた火災保険料,自宅にかけた火災保険料,自家用車の任意保険料,旅行保険料,個人事業主は事業に直接必要な支出を必要経費にできます。事業用の建物や設備など事業用資産にかけた火災保険料は事業に必要な支出として必要経費に該当します。一方で自宅や自家用車など私用部分の保険料は家事費となり原則として必要経費になりません。
65,不動産,不動産登記で所有権移転登記の登録免許税の税率は原則いくら？,固定資産税評価額の1000分の20,固定資産税評価額の1000分の10,固定資産税評価額の100分の2,固定資産税評価額の100分の1,登録免許税は登記の種類ごとに税率が定められています。所有権移転登記の原則税率は固定資産税評価額の2％であり1000分の20に相当します。住宅用などで軽減措置がある場合もありますがまずは原則の2％を基準として覚えます。
66,金融資産運用,利回りと利率の違いとして正しいのはどれ？,利回りは購入価格も考慮し利率は額面や元本に対する割合,利回りは額面に対する割合で利率は購入価格に対する割合,利回りも利率も常に同じ意味,利回りは税引後のみを指し利率は税引前のみを指す,利率は額面金額や預入元本に対して受け取る利息の割合を示す用語です。一方で利回りは実際に投資した金額に対してどれだけの収益が得られたかを示す概念で購入価格や運用期間などの影響を反映します。債券を額面より高く買った場合などは利率が高く見えても実質の利回りは低下するため両者の違いを押さえます。
67,タックスプランニング,給与所得控除はどの所得区分の計算で用いる？,給与所得,事業所得,不動産所得,一時所得,給与所得は収入金額から給与所得控除を差し引いて計算します。給与所得控除は給与所得者の必要経費に代わる概算控除として位置付けられています。事業所得や不動産所得は実際の必要経費を計上するため給与所得控除は使いません。所得区分ごとの計算式の違いは基礎論点です。
68,年金,国民年金の第1号被保険者に該当するのはどれ？,自営業者や学生などで第2号第3号以外,会社員,会社員に扶養される配偶者,公務員,国民年金の被保険者は第1号から第3号に区分されます。第1号は自営業者や学生などで厚生年金等に加入する第2号でも第2号に扶養される第3号でもない人です。会社員や公務員は第2号でありその被扶養配偶者が第3号です。区分を誤ると保険料負担や給付の理解がずれます。
69,ライフプランニング,キャッシュフロー表で一般に収入から差し引いて算出する可処分所得は何を控除する？,税金と社会保険料,住居費と教育費,食費と保険料,貯蓄額のみ,可処分所得は手取りとして使えるお金の考え方で総収入から税金と社会保険料を差し引いて求めます。住居費や食費などの生活費は可処分所得をどのように配分するかの支出側で扱います。キャッシュフロー表ではまず手取りを把握してから各費目に配分する流れになります。
70,リスク管理,地震保険は単独で加入できる？,火災保険とセットで加入する,地震保険のみで加入できる,自動車保険に付帯して加入する,傷害保険に付帯して加入する,地震保険は原則として火災保険に付帯して契約します。地震による火災や損壊は火災保険だけでは補償されないため地震保険でカバーしますが地震保険単独契約はできません。試験では単独加入の可否と火災保険の補償対象外である点をセットで問われやすいです。
71,相続,死亡保険金の非課税限度額は？,500万円×法定相続人数,300万円×法定相続人数,一律500万円,相続財産の10％まで,相続で受け取る死亡保険金は一定額まで相続税がかからない。非課税枠は法定相続人数に比例して増え「500万円×法定相続人数」。相続人が多いほど非課税枠が大きくなる点が重要。
72,保険,医療保険の入院給付金は所得税の課税対象？,原則として非課税,給与所得として課税,一時所得として課税,雑所得として課税,病気やけがにより支払われる入院給付金などは生活補填の性格が強く原則として非課税。保険金が課税になるのは満期保険金や解約返戻金など資産の増加に近い性格のものが中心で入院給付金とは区別する。
73,不動産,重要事項説明を行い記名するのは原則として誰？,宅地建物取引士,不動産鑑定士,司法書士,管理業務主任者,売買や賃貸の契約前に行う重要事項説明は宅地建物取引士が行うのが原則。説明をした取引士は重要事項説明書に記名する。無資格者が単独で説明することはできない点を押さえる。
