ID,Category,Question,Choice1,Choice2,Choice3,Choice4,Explanation
466,相続,遺産分割協議に参加できる人として一般に正しいのはどれ？,相続人全員（原則）,受遺者全員,被相続人の友人,相続財産の債権者,遺産分割協議は、相続財産を誰が何を取得するかを決める手続で、原則として相続人全員の参加と合意が必要になる（欠けると無効となるリスクが高い）。受遺者は遺言で特定財産を受け取る立場であり、相続人とは区別される。債権者や友人は当事者ではないため参加できない。誰が「相続の当事者」かを押さえると、遺産分割の有効性判断がしやすい。
467,ライフプランニング,年金の「繰上げ受給」の一般的な影響として正しいのはどれ？,受給開始を早める代わりに年金額が原則として減額され、その減額率は生涯続く,受給開始を早めると年金額が増額される,繰上げ受給をしても年金額は変わらない,繰上げ受給の減額は65歳到達時点で元に戻る,繰上げ受給は、原則として受給開始年齢を早められる一方、1か月繰り上げるごとに一定率で年金額が減額され、その減額は生涯続くのが基本。短期的な資金需要には有効だが、長寿リスク（長く生きるほど総受給額が不利になり得る）と表裏一体である。制度の選択は「いつから」「いくら」「どれくらいの期間受け取るか」という時間軸で考えることが重要。
468,リスク管理,傷害保険（普通傷害保険など）の補償対象として一般に適切なのはどれ？,急激かつ偶然な外来の事故によるケガ,病気が原因の入院,地震による家屋の損壊,失業による収入減少,傷害保険は「急激・偶然・外来」という事故要件を満たすケガを対象とするのが基本で、病気による入院は医療保険の領域になる。外来性がポイントで、体内の疾病起因は原則対象外。補償対象（ケガか病気か、物損か所得減か）を先に分類すると、保険種目の選択や設計が合理的になる。
469,金融資産運用,債券価格と市場金利の一般的な関係として正しいのはどれ？,市場金利が上昇すると既発債券価格は下落しやすい,市場金利が上昇すると既発債券価格も上昇しやすい,市場金利と債券価格は常に無関係である,市場金利が変動しても債券価格は必ず一定である,既に発行されている債券（既発債）は、クーポン（利率）が固定のため、市場金利が上がると相対的に魅力が下がり、価格が下落して利回りが市場水準に近づく方向に調整される。逆に市場金利が下がると既発債のクーポンが相対的に有利になり価格が上がりやすい。この逆相関は債券の基本構造で、金利リスク（価格変動）を理解する核心となる。
470,タックスプランニング,所得控除と税額控除の違いとして正しいのはどれ？,所得控除は課税所得を減らし、税額控除は算出税額から直接差し引く,所得控除は算出税額から直接差し引き、税額控除は課税所得を減らす,どちらも同じ意味で区別はない,税額控除は住民税だけに適用される,所得控除は「所得から控除して課税所得を小さくする」仕組みで、税率を掛ける前の土台を減らす。一方、税額控除は計算された税額そのものから直接差し引くため、同じ金額なら一般に税額控除の方が効果が分かりやすい。設問で混同しやすいが、どの段階で差し引かれるか（所得段階か税額段階か）を意識すると確実に判別できる。
471,相続,相続放棄ができる期間として一般に正しいのはどれ？,自己のために相続の開始があったことを知った時から3か月以内,被相続人の死亡日から必ず1年以内,遺産分割協議が終わるまでいつでも可能,相続税の申告期限までなら可能,相続放棄は原則として自己のために相続の開始があったことを知った時から3か月以内に行う必要がある。この期間は熟慮期間と呼ばれ相続財産と債務を調査し相続するか放棄するかを判断するために設けられている。死亡日からの起算ではなく知った時から起算である点がひっかけになりやすい。遺産分割や相続税申告の期限とは別の制度であり混同しないことが重要。
472,不動産,不動産登記のうち所有者の氏名や住所などを記録する一般的な部分はどれ？,権利部の甲区,権利部の乙区,表題部,日本銀行当座預金口座,登記簿は大きく表題部と権利部に分かれ権利部は甲区と乙区で構成される。甲区には所有権に関する事項が記録され所有者の氏名住所や所有権移転の履歴などが載る。乙区は抵当権など所有権以外の権利が中心である。表題部は所在地や地積など物理的な表示に関する情報であり人物情報とは役割が異なる。
473,リスク管理,生命保険の保険料払込免除特約で免除の対象になりやすいのはどれ？,所定の高度障害状態など所定の条件に該当した場合の以後の保険料,契約者が引っ越した場合の保険料,契約者の収入が減った場合の保険料,保険会社の業績が悪化した場合の保険料,保険料払込免除特約は一定の事故や状態に該当したとき以後の保険料の払込みが不要になる仕組みで保障は継続するという考え方である。代表例として所定の高度障害状態や重い疾病状態などが条件になりやすい。単なる生活環境の変化や収入減は一般に免除条件ではなく家計リスクの対処は保険設計や見直しで行う。制度の趣旨は重大事由発生後も保障を途切れさせない点にある。
474,金融資産運用,投資信託の信託報酬として一般に正しい説明はどれ？,運用管理等の対価として信託財産から日々差し引かれる費用,購入時にだけかかり以後は発生しない費用,解約時に必ず一律でかかる税金,株式の配当金のこと,信託報酬は投資信託の運用管理や事務を行うための費用で信託財産から継続的に差し引かれるため保有期間が長いほど影響が積み上がる。購入時のみの費用は販売手数料であることが多く解約時の費用は信託財産留保額が論点になる。税金や配当金とは性質が異なり費用構造として理解することが重要。コストは運用成果に直結するため比較時は信託報酬の水準を確認する。
475,タックスプランニング,年末調整で一般に行われないものはどれ？,医療費控除の適用,扶養控除の適用,生命保険料控除の適用,地震保険料控除の適用,年末調整は給与所得者について勤務先が所得税の精算を行う手続で扶養控除や生命保険料控除など所定の所得控除を反映できる。一方で医療費控除は本人が医療費の集計を行い確定申告で適用するのが原則で年末調整だけでは完結しない。どの控除が会社で処理できるかは申告書類の提出で足りるか個別計算が必要かで整理すると覚えやすい。医療費控除は明細作成など本人作業が中心となるため確定申告の代表例として扱われる。
476,ライフプランニング,厚生年金保険料の一般的な負担の仕組みとして正しいのはどれ？,労使折半で事業主と被保険者が半分ずつ負担する,全額を被保険者が負担する,全額を事業主が負担する,国民年金の定額保険料と同じ仕組みである,厚生年金保険料は原則として労使折半で事業主と被保険者が同じ割合で負担するため給与明細には本人負担分が控除として表示される。国民年金は定額保険料であり計算方法が異なる。公的年金の制度は加入区分ごとに保険料の決まり方と負担者が違うため仕組みを対比して覚えると混乱が減る。労使折半は社会保険の基本として頻出である。
477,相続,配偶者と子2人が相続人の場合の配偶者の法定相続分として一般に正しいのはどれ？,2分の1,3分の2,4分の3,全額,法定相続分は相続人の組合せで定められ配偶者と子が相続人のとき配偶者は2分の1で子全体が残り2分の1を分け合う。子が2人なら各子は4分の1ずつとなる。ここで重要なのは配偶者が常に一定割合を持つわけではなく相続人が直系尊属か兄弟姉妹かで配偶者割合が変わる点である。設問は子がいる典型形であり2分の1を基準として即答できるようにする。
478,不動産,建物の賃貸借で借主の地位を手厚く保護する法律として一般に正しいのはどれ？,借地借家法,民法の不法行為,会社法,金融商品取引法,建物の賃貸借や借地に関する重要なルールは借地借家法が中心となり契約更新や正当事由など借主を保護する仕組みが用意されている。民法にも賃貸借の規定はあるが借地借家法は特別法として優先して適用される場面が多い。会社法や金融商品取引法は不動産賃貸借の保護とは直接関係しない。どの法律がどの取引領域を規律するかを把握すると問題の切り分けが容易になる。
479,リスク管理,自動車保険の対人賠償保険で一般に補償される内容として正しいのはどれ？,事故で他人を死傷させた場合の損害賠償責任による賠償,自分の車の修理費用,自分のケガの治療費だけ,自分の車の盗難による損害,対人賠償保険は自動車事故により他人を死傷させ法律上の損害賠償責任を負った場合にその賠償を補償する。自分の車の修理は車両保険が論点であり自分のケガは人身傷害保険や搭乗者傷害保険が中心となる。盗難も車両保険の対象として扱われることが多い。自動車保険は補償対象が他人か自分か物か身体かで商品が分かれるためまず対象を分類して選ぶのが基本である。
480,金融資産運用,外貨預金の一般的なリスクとして適切なのはどれ？,為替変動により円換算の元本が増減する為替リスク,為替変動があっても円換算元本は常に一定,預入期間中は必ず円金利と同じ利息になる,外貨預金には手数料が一切かからない,外貨預金は外貨建てで資産を保有するため円に換算した元本や利息の価値は為替レートの変動に左右される。円高になると円換算では元本割れになり得る一方で円安なら円換算が増えることもある。さらに預入や払戻しの際に為替手数料が発生し実質的なコストとなる点も重要である。金利だけで判断すると為替と手数料で想定と異なる結果になりやすいため総合的にリスクとコストを確認する必要がある。
481,タックスプランニング,給与所得控除の考え方として正しいのはどれ？,給与収入に応じて自動的に一定額が差し引かれる概算控除,実際に支払った通勤費だけが差し引かれる控除,医療費の合計額がそのまま差し引かれる控除,扶養親族がいる場合だけ差し引かれる控除,給与所得控除は給与所得者の必要経費に相当するものとして給与収入に応じて一定の算式で自動的に控除される仕組みであり個別の領収書集計が不要である点が特徴である。通勤費は非課税限度額の論点で扱われ医療費は医療費控除として別枠で確定申告が必要となる場合がある。扶養親族の有無は扶養控除に関わるが給与所得控除そのものの要件ではない。給与収入からまず給与所得控除を引いて給与所得を求める流れを押さえると税額計算の全体像が整理できる。
482,金融資産運用,株式の配当金を受け取ったときに一般に交付される書類として適切なのはどれ？,配当金支払通知書,固定資産税納税通知書,損益計算書,保険証券,株式の配当を受領すると配当金の額や受取方法等が記載された配当金支払通知書などが交付されるのが一般的である。確定申告や配当課税の取扱いを確認する際にも基礎資料となる。固定資産税納税通知書は不動産課税に関する自治体の書類であり株式配当とは無関係である。損益計算書は企業の財務諸表で投資家に提供されることはあるが配当受領の通知書そのものではない。保険証券は保険契約の証明であり金融商品として別領域である。
483,ライフプランニング,老齢基礎年金を満額受給するための原則として正しいのはどれ？,保険料納付済期間と免除期間などを合算して所定の期間を満たす必要がある,国民年金に1年加入すれば満額になる,厚生年金に加入していれば国民年金の加入期間は不要,年齢に達すれば加入歴がなくても必ず受給できる,老齢基礎年金は所定の受給資格期間を満たしたうえで保険料を納付した期間等に応じて年金額が決まる仕組みである。満額は一定の加入期間全体を通じて保険料を納付した状態を前提とし納付済期間に加え免除期間などは受給資格期間には算入されても年金額は減額要素になり得る点が重要である。短期間加入で満額になるわけではなく加入歴がなければ受給自体が成立しない。基礎年金は全国民共通の土台であり厚生年金加入者も基礎年金部分を含む二階建て構造として理解すると整理しやすい。
484,リスク管理,火災保険で一般に補償対象になりやすい損害として適切なのはどれ？,火災による建物や家財の損害,自動車事故による相手方のケガの賠償,病気で入院した際の給付,投資信託の価格下落による損失,火災保険は火災を中心に落雷や破裂爆発など契約内容に応じた偶然な事故による建物や家財の損害を補償する。自動車事故の対人賠償は自動車保険の領域であり病気入院は医療保険など生命保険系でカバーする。投資信託の価格変動は投資リスクであり保険の損害補償とは性質が異なる。どの保険が何のリスクを対象にしているかを資産と責任と身体の三分類で考えると迷いにくい。
485,不動産,固定資産税の課税標準の基礎として一般に用いられるものはどれ？,固定資産税評価額,取得価額,時価である実勢価格,建物の再調達価格そのもの,固定資産税は市町村が課税主体となり課税標準は原則として固定資産税評価額に基づく。取得価額や実勢価格は参考になることはあっても課税標準として直接使うのが原則ではない点がポイントである。再調達価格は保険評価などで用いられる概念であり税の課税標準とは切り分ける必要がある。納税通知書に記載される評価額や課税標準額の意味を理解しておくと税額の変動理由を説明しやすくなる。
486,相続,遺言書のうち家庭裁判所の検認が原則不要なものとして一般に正しいのはどれ？,公正証書遺言,自筆証書遺言,秘密証書遺言,口頭での遺言,遺言書は形式ごとに作成手続と保管方法が異なり家庭裁判所の検認要否も変わる。公正証書遺言は公証人が関与して作成され原本が公証役場に保管されるため偽造変造のリスクが低く検認は不要とされる。自筆証書遺言や秘密証書遺言は原則として検認手続が必要で相続開始後に勝手に開封すると過料の対象になり得る点が注意事項である。口頭の遺言は原則認められず特別な場合を除き有効性が問題となるため選択肢として不適切である。
487,金融資産運用,債券の価格と市場金利の一般的な関係として正しいのはどれ？,市場金利が上がると既発債券価格は下がりやすい,市場金利が上がると既発債券価格は上がりやすい,市場金利と債券価格には関係がない,市場金利が下がると既発債券価格は下がりやすい,債券は将来の利息と償還金が確定しているため市場金利が上昇すると相対的に既発債券の利回りが見劣りし価格は下落しやすいという逆相関が基本である。反対に市場金利が低下すると既発債券の利回りが相対的に魅力的になり価格は上昇しやすい。ここで重要なのは債券の利回り調整が価格を通じて行われる点であり金利リスクは債券投資の中心論点である。保有目的が満期までか途中売却かで価格変動の影響の受け方が変わる点も併せて理解しておくと実務的である。
488,ライフプランニング,雇用保険の基本手当を受給するための一般的な要件として適切なのはどれ？,働く意思と能力があり求職活動をしている,就職する意思がなくても退職していれば受給できる,自営業を開始していても必ず受給できる,学生であっても在学中は自動的に受給できる,基本手当は失業中の生活を支えつつ再就職を促す制度であるため受給には就職する意思と能力があり積極的に求職活動を行っていることが前提となる。就職意思がなければ失業の状態とみなされず受給要件を満たさない。自営業開始は就職した又は就労した扱いとなる場合があり受給停止や返還のリスクがあるため注意が必要である。在学中の学生は原則として就職意思能力の認定が難しく対象外となることが多い。制度趣旨を理解すると要件問題で迷いにくい。
489,リスク管理,生命保険の受取人を指定する目的として適切なのはどれ？,保険金を受け取る人を明確にして支払先を確定させる,保険料を安くするためだけの手続である,必ず法定相続分どおりに分配させるための手続である,税金を必ずゼロにするための手続である,生命保険は契約で受取人を指定でき保険事故発生時に誰に保険金を支払うかを明確にすることで支払手続を円滑にし遺族の資金確保を確実にする役割を持つ。受取人指定は保険料水準を直接決める要素ではなく保障内容や年齢等が中心となる。受取人は法定相続分と一致させる義務はなく遺産分割とは別枠で扱われることが多い点が実務上の重要ポイントである。税務上は契約形態により課税関係が変わり得るため受取人指定だけで税金が必ずゼロになるわけではない。
490,不動産,不動産取引で売主が宅地建物取引業者で買主が宅地建物取引業者でない場合に適用されやすい制度はどれ？,クーリングオフが条件を満たせば利用できる場合がある,買主は無条件でいつでも解約できる,売主は必ず手付金を返さなくてよい,口頭の契約でも常に有効で書面は不要である,売主が宅地建物取引業者で買主が一般消費者の場合は消費者保護の観点から一定の条件下でクーリングオフが認められることがある。例えば事務所等以外の場所で申込みや契約をした場合など要件があり無条件でいつでも解約できる制度ではない。手付金の扱いも手付解除や違約金の枠組みで決まり一方的に返さなくてよいという整理にはならない。不動産取引では重要事項説明や書面交付が制度上重視され口頭だけで足りるという考え方は原則として適切ではない。要件型の制度であることを押さえると選択肢の切り分けができる。
491,相続,配偶者と子が法定相続人の場合の配偶者の法定相続分は？,2分の1,3分の1,3分の2,全部,配偶者と子が共同相続人のときは配偶者が2分の1で子全体が2分の1を分け合う。子が複数いる場合は子の取り分2分の1を人数で等分する。遺言があれば遺言が優先されるが法定相続分の基準はこの割合になる。
492,不動産,普通借家契約の更新に関する説明として正しいものはどれ？,原則更新があり貸主は正当事由がないと更新拒絶しにくい,更新は一切できず必ず期間満了で終了する,更新は借主の同意がなくても自動的に賃料が2倍になる,更新の有無は法律で定められておらず口約束でも無効,普通借家契約は期間満了で終了する可能性はあるが実務上は更新が前提になりやすい。貸主が更新拒絶や解約申入れをするには正当事由が求められやすく借主保護が強い。一方で定期借家契約は更新がなく期間満了で終了する点が大きく異なる。
493,タックス,住民税が原則として課税対象とする所得はいつの所得？,前年の所得,当年の所得,前々年の所得,翌年の所得,住民税は原則として前年の所得を基に計算され翌年度に課税される。たとえば今年の所得は翌年の住民税算定の基礎になり翌年の6月頃から納付が始まる。所得税は原則当年課税である点と混同しやすい。
494,金融,投資信託の基準価額の説明として正しいものはどれ？,通常は1万口当たりの純資産価額を示す,発行会社の資本金額を示す,必ず1口当たりで表示される,購入時の手数料を含む固定価格で変動しない,基準価額は投資信託が保有する資産の時価から負債を差し引いた純資産を口数で割って算出される指標で日々変動する。日本では慣行として1万口当たりで表示されることが多い。手数料は別途で基準価額そのものに固定的に上乗せされるものではない。
495,ライフプラン,退職所得控除の計算で勤続20年以下の基本部分として正しいものはどれ？,40万円×勤続年数 ただし最低80万円,20万円×勤続年数 ただし最低40万円,100万円×勤続年数 ただし最低200万円,退職金は全額が非課税なので控除計算は不要,退職所得控除は退職金の税負担を軽くするための仕組みで勤続年数に応じて控除額が増える。勤続20年以下は40万円×勤続年数で計算し短期勤続でも一定の配慮として最低80万円が確保される。勤続20年超は計算式が別になり増加の仕方が変わる。
496,リスク,地震保険について正しいものはどれ？,火災保険とセットで付帯して加入する,地震保険は単独で自由に加入できる,地震による火災は火災保険だけで必ず全額補償される,地震保険は保険金が必ず満額支払われる定額保険である,地震による損害は通常の火災保険だけでは補償されないことが多いため地震保険を付帯して備える。地震保険は火災保険に付帯する形が原則で単独加入はできない。損害の程度に応じて支払割合が決まる仕組みで必ず満額という性質ではない。
497,相続,相続放棄の申述が原則として可能な期限はいつまで？,相続開始を知った日から3か月以内,相続開始から1年以内,被相続人の死亡日から7日以内,いつでも可能で期限はない,相続放棄は家庭裁判所へ申述する手続で原則として自己のために相続の開始があったことを知った日から3か月以内に行う。期間内に判断できない事情があれば期間伸長の申立てが検討される。単に何もしないと放棄にはならず原則として相続を承認したものと扱われ得る点が重要。
498,不動産,登記簿の区分で抵当権などの担保権が記録されるのはどれ？,乙区,甲区,表題部,閉鎖登記簿,登記簿は一般に表題部と権利部に分かれ権利部は甲区と乙区に整理される。甲区は所有権に関する事項で所有権移転などが記録される。乙区は抵当権など所有権以外の権利が記録されるため担保権は乙区で確認する。
