ID,Category,Question,Choice1,Choice2,Choice3,Choice4,Explanation
195,ライフプランニング,国民年金の第1号被保険者に該当する人として正しいのは？,自営業者や学生など（会社員でない人が中心）,会社員（厚生年金の加入者）,会社員に扶養されている配偶者,公務員のみ,国民年金は被保険者を第1号?第3号に区分する。第1号は自営業者・学生・無職など、会社員や公務員（厚生年金加入者）ではない人が中心となる。第2号は会社員・公務員など厚生年金の加入者、第3号は第2号に扶養される配偶者である。区分によって保険料の納め方や手続が異なるため、就職・退職・結婚などのライフイベント時に切替漏れを防ぐことが重要となる。
196,ライフプランニング,キャッシュフロー表の説明として最も適切なのは？,将来の収入・支出・貯蓄残高の推移を時系列で示す表,家計の支出を科目別に分類するだけの表,保険商品の保障内容だけを比較する表,投資信託の基準価額の推移だけを示す表,キャッシュフロー表は、ライフイベント（教育費、住宅取得、退職など）を踏まえて、将来の収入・支出・貯蓄残高（金融資産残高）の推移を年次などで見える化するための表である。家計簿のような科目分類だけではなく、「将来の資金不足がいつ起きそうか」「どの程度の余裕資金が見込めるか」を把握し、貯蓄・保険・運用・住宅ローンなどの方針を整合させるために用いる点が特徴である。
197,リスク管理,個人賠償責任保険で補償される内容として一般に正しいのは？,日常生活で他人にケガをさせたり他人の物を壊したりした賠償責任,自分の病気やけがの治療費,自分の車の修理費,地震で自宅が倒壊した損害,個人賠償責任保険は、日常生活における偶然な事故により第三者に損害を与え、法律上の賠償責任を負った場合に、その賠償金や関連費用を補償する。例えば自転車事故、子どもが他人の物を壊した、飼い犬が他人に噛みついた等が典型例である。自分自身の医療費は医療保険、車両の損害は自動車保険、地震による建物損害は地震保険など、補償領域が異なる点を押さえることが重要となる。
198,リスク管理,定期保険の特徴として正しいのは？,一定期間のみ保障し満了まで生存すれば保険金は原則受け取らない,一生涯保障が続き解約返戻金が必ず大きい,貯蓄性が高く満期金が必ず支払われる,入院費用だけを補償する保険である,定期保険は「一定期間の死亡保障」を提供する保険で、保障期間中に死亡等があれば保険金が支払われる一方、満了まで生存すれば原則として保険金は受け取らない（掛捨てのイメージ）。その分、同程度の保障額で比較すると保険料が抑えられやすく、子育て期など一定期間に大きな保障が必要な場合に活用される。終身保険や養老保険などの貯蓄性商品とは目的が異なる。
199,不動産,住宅ローンに付帯する団体信用生命保険（団信）の一般的な役割として正しいのは？,債務者が死亡等した場合に残りの住宅ローンが保険金で返済される,住宅の修繕費が自動的に補償される,金利が必ず引き下げられる,固定資産税が免除される,団体信用生命保険（団信）は、住宅ローンの債務者が死亡または所定の高度障害状態になった場合などに保険金が支払われ、その保険金で残債が弁済される仕組みである。遺族にローン返済負担を残しにくい点が大きな意義となる。一方、住宅の修繕や税金の免除とは別の制度であり、近年はがん保障など特約型もあるため、保障範囲・上乗せ金利・加入条件を整理して選択することが重要となる。
200,金融資産運用,債券価格と利回りの関係として一般に正しいのは？,債券価格が上がると利回りは下がりやすい,債券価格が上がると利回りも上がりやすい,債券価格と利回りは無関係である,利回りは必ず一定で変化しない,債券の利回りは、将来受け取る利息や償還額に対して「いまいくらで買うか（価格）」で決まるため、価格と利回りは逆方向に動きやすい。例えば同じ利息額の債券でも、購入価格が高いほど投資額に対する利息割合は小さくなり、利回りは低下する。市場金利が上がると既発債の魅力が相対的に下がり価格が下落しやすい、といった金利変動リスクの理解にも直結する基本関係である。
201,相続,相続放棄ができる期間として正しいのはどれ？,自己のために相続の開始があったことを知った時から3か月以内,相続開始から10か月以内,相続開始から1年以内,いつでもできる,相続放棄は無制限にできる手続ではなく原則として自己のために相続が開始したことを知った時から3か月以内に家庭裁判所へ申述する必要がある。この期間は一般に熟慮期間と呼ばれ相続財産と相続債務の調査検討を行うための猶予である。期限を過ぎると単純承認したものと扱われる可能性があるため債務が疑われる場合は早期に調査し必要に応じて専門家へ相談することが実務上重要となる。
202,タックスプランニング,配偶者控除の適用要件として一般に正しいのはどれ？,配偶者の合計所得金額が一定以下であることが必要,配偶者が必ず65歳以上であることが必要,配偶者が必ず自営業であることが必要,配偶者が必ず障害者であることが必要,配偶者控除は納税者本人の所得条件と配偶者の合計所得金額が一定以下であることなどの要件を満たす場合に適用される。年収だけで判断すると誤りやすく給与所得者の場合は給与収入から給与所得控除を差し引いた後の合計所得金額で判定する点が重要である。要件を外れると配偶者控除ではなく配偶者特別控除の対象となる場合があるため境界付近では所得見込みの管理が実務上のポイントとなる。
203,ライフプランニング,老齢基礎年金を原則として受給開始できる年齢は？,65歳,60歳,62歳,70歳,老齢基礎年金は原則として65歳から受給開始となる。繰上げ受給や繰下げ受給により開始時期を変更できるが繰上げは減額繰下げは増額となり一度決めると原則として変更できないため慎重な判断が必要である。生活資金の見通し就労予定健康状態などを踏まえ受給開始時期を選択することがライフプラン設計上の重要な論点となる。
204,リスク管理,火災保険で一般に補償対象になりにくいものはどれ？,地震による損害,火災による損害,落雷による損害,風災による損害,火災保険は火災落雷風災などによる損害を補償する設計が一般的だが地震噴火津波に起因する損害は原則として火災保険だけでは補償されない。そのため地震による火災や倒壊などのリスクに備えるには地震保険の付帯が必要となる。補償範囲は契約内容で異なるため免責や特約の有無を確認し自宅の立地リスクに合わせて設計することが重要である。
205,金融資産運用,投資信託の分配金に関する説明として正しいのはどれ？,分配金は運用益だけでなく元本から支払われる場合もある,分配金は必ず運用益のみから支払われる,分配金が多いほど必ず投資成績が良い,分配金が出る投資信託は必ず元本保証である,投資信託の分配金は運用益から支払われる場合もあれば元本の一部を取り崩して支払われる場合もあるため分配金の多寡だけで成績を判断するのは危険である。元本を取り崩す分配は基準価額の下落を伴いやすく長期資産形成では再投資方針も含めた設計が重要となる。分配方針や分配頻度は商品ごとに異なるため目論見書等で確認し目的に合うか判断する必要がある。
206,不動産,借地借家法における普通借家契約の説明として正しいのはどれ？,更新があり得て借主保護が相対的に強い,契約期間満了で必ず終了し更新できない,貸主は理由なくいつでも解約できる,賃料は法律で一律に固定される,普通借家契約は更新が予定され借主の居住安定を重視する仕組みであるため貸主が契約を終了させるには正当事由が求められるなど借主保護が相対的に強い。これに対し定期借家契約は期間満了で終了することを合意する形で更新が原則ない点が大きな違いとなる。契約形態を誤認すると更新や立退きの取り扱いに影響するため契約書面での確認が重要である。
207,相続,遺産分割協議が成立しない場合に遺産分割を進める手続として正しいのは？,家庭裁判所で遺産分割調停や審判を利用する,税務署で必ず決定してもらう,市区町村が強制的に分割する,相続人の多数決だけで強制確定できる,相続人全員の合意が得られない場合は遺産分割協議だけで確定させることはできないため家庭裁判所の遺産分割調停を利用しそれでもまとまらなければ審判により分割内容が定められる流れが一般的である。多数決で強制確定はできず合意形成が基本となる。預貯金の払戻しや不動産名義変更など実務手続にも影響するため早期に相続人確定と資料収集を行い必要に応じて調停手続を検討することが重要となる。
208,タックスプランニング,所得税の確定申告が必要となりやすいケースとして一般に正しいのはどれ？,給与所得者でも給与以外の所得が一定額を超える場合,給与所得者は誰でも必ず毎年確定申告が必要,年末調整を受けた人は絶対に申告できない,住民税だけ払えば所得税申告は不要,給与所得者は年末調整で所得税計算が完結することが多いが給与以外の所得が一定額を超える場合などは確定申告が必要になりやすい。年末調整を受けていても医療費控除や寄附金控除などで還付申告が可能な場合もあり申告が一律に禁止されるわけではない。自分が申告義務に該当するかは所得の種類と金額控除の有無で決まるため収入の内訳を整理して判断することが重要である。
209,リスク管理,傷害保険で一般に補償対象となる事故として適切なのはどれ？,急激かつ偶然な外来の事故によるケガ,病気による入院,妊娠出産に伴う入院,加齢による関節痛の治療,傷害保険は急激偶然外来という要件を満たす事故によるケガを補償対象とするのが基本である。病気や妊娠出産加齢に伴う症状は外来の事故とはいえないため通常は医療保険等の領域となる。事故性の有無や発生状況により支払可否が分かれるため保険金請求ではいつどこでどのように受傷したかを説明できるよう記録を残すことが実務上有用である。
210,金融資産運用,複利運用の説明として正しいのはどれ？,利息や運用益を元本に組み入れてその後の利息も増えていく仕組み,利息は必ず一定額で増えない仕組み,元本が減っていく仕組み,短期では必ず単利より不利になる仕組み,複利運用は得られた利息や運用益を元本に組み入れて再投資し次回以降は増えた元本に対して利息が付くため時間の経過とともに成長が加速しやすい仕組みである。単利は元本部分にのみ利息が付くため長期では複利との差が拡大しやすい。長期の資産形成では運用利回りだけでなく運用期間と再投資の継続が成果に影響するため途中で取り崩すタイミングや手数料も含めて設計することが重要となる。
211,不動産,不動産の登記に関する説明として正しいのはどれ？,登記は第三者に対する権利主張に役立つが登記しなくても当事者間の売買自体は有効,登記をしない売買契約は無効になる,登記をすると必ず税金がゼロになる,登記は役所の内部記録で第三者には一切関係しない,不動産の売買契約は当事者間では合意により成立し登記がなくても契約自体は有効である。一方で登記は所有権などの権利関係を外部に示す仕組みであり第三者に対して自分の権利を主張するうえで重要となる。たとえば同一不動産が二重に譲渡された場合など登記の有無が対抗関係に影響し得るため実務では決済と同時に移転登記を行いリスクを抑えるのが基本である。
212,ライフプランニング,キャッシュフロー表の主な目的として適切なのはどれ？,将来の収支と貯蓄残高の推移を見える化して資金不足の時期を把握する,税額だけを計算して納税額を確定する,保険会社の利益を増やすために作る,投資の短期売買タイミングだけを決める,キャッシュフロー表は家計の将来の収入支出とそれに伴う貯蓄残高の推移を時系列で整理し資金が不足しやすい時期や教育費住宅費老後資金などの大きな支出の影響を把握するために用いる。目的は将来の意思決定を支えることであり住宅取得時期の調整保険の見直し貯蓄ペースの変更など具体策の検討に繋がる。現状の前提が変われば結果も変わるため定期的に更新し複数シナリオで確認することが実務上有効である。
213,相続,遺言書のうち家庭裁判所の検認が不要なものはどれ？,公正証書遺言,自筆証書遺言,秘密証書遺言,口頭の遺言,公正証書遺言は公証人が作成に関与し原本が公証役場に保管されるため改ざんや隠匿のリスクが低く家庭裁判所の検認手続が不要とされる。一方で自筆証書遺言や秘密証書遺言は原則として検認が必要となり相続開始後に手続を踏まないと遺言の執行や名義変更が進めにくい。遺言の種類により作成コストや要件の厳格さ保管方法が異なるため確実性を重視する場合は公正証書遺言が実務で選ばれやすい。
214,金融資産運用,株式投資のリスクに関する説明として正しいのはどれ？,株価変動により元本割れの可能性がある,株式は必ず元本が保証される,株式は預金と同じで利息が確定している,株式は価格が動かないためリスクがない,株式は企業の業績や金利景気為替など多様な要因で価格が変動し売却時の価格によっては投資元本を下回る可能性があるため元本保証ではない。リターンの源泉は値上がり益と配当でありいずれも確実ではない点が重要となる。リスク管理としては分散投資投資期間の確保損失許容度の設定などが基本であり短期の値動きだけで判断せず目的に沿った運用方針を定めることが求められる。
215,タックスプランニング,給与所得控除に関する説明として適切なのはどれ？,給与収入から一定の計算式で差し引かれるみなし必要経費のような控除,給与所得者が申請しないと絶対に使えない特別控除,全ての収入に一律で適用される控除,事業所得にだけ適用される控除,給与所得控除は給与所得者の必要経費に相当するものとして給与収入から一定額を控除して給与所得を計算する仕組みであり個別に領収書を集めて経費計上する方式とは異なる。年末調整や確定申告で給与所得を計算する際に自動的に反映されるため通常は別途の申請手続を要しない。控除額は給与収入に応じた計算となり収入と所得を混同すると判定を誤りやすいため所得控除等と合わせて計算構造を整理することが重要である。
216,リスク管理,生命保険の受取人固有の権利に関する説明として正しいのはどれ？,死亡保険金は原則として受取人固有の財産として扱われる,死亡保険金は必ず相続財産に含まれ遺産分割の対象になる,死亡保険金は必ず国に没収される,死亡保険金は誰が受け取っても税金は一切かからない,死亡保険金は契約で指定された受取人が受け取る権利を持つため原則として受取人固有の財産と整理され遺産分割協議の対象外となるのが基本である。ただし課税関係は契約者被保険者受取人の組合せで相続税贈与税所得税のいずれが適用されるかが変わり得る点に注意が必要である。遺産分割の公平性調整として特別受益等の議論が生じることもあるため契約設計時点で家族の合意形成を図ることが実務上重要となる。
217,不動産,住宅ローンの金利タイプに関する説明として正しいのはどれ？,固定金利は返済期間中の適用金利が原則一定で返済額の見通しを立てやすい,変動金利は返済期間中に金利が一切変わらない,固定金利は必ず変動金利より総返済額が少ない,金利タイプによるリスク差は存在しない,固定金利型は原則として適用金利が一定であるため毎月返済額の見通しが立てやすく金利上昇リスクを取りにくい一方当初金利が相対的に高くなりやすい。変動金利型は市場金利の変動に応じて適用金利が見直されるため金利上昇時には返済負担が増える可能性がある。家計の安定性金利上昇への耐性借入期間などを踏まえリスク許容度に合うタイプを選ぶことが重要となる。
218,ライフプランニング,年金の保険料納付に関する基本的な考え方として適切なのはどれ？,保険料の未納期間があると将来の年金額や受給資格期間に影響する,未納でも将来の年金額はまったく変わらない,納付は任意で支払っても支払わなくても同じ,未納期間があると必ず受給開始年齢が50歳になる,公的年金は原則として保険料納付を通じて給付を受ける社会保険であり未納期間があると将来の年金額が減少し得るほか受給資格期間にも影響しうる。特に受給に必要な期間要件を満たさない場合は老齢年金を受け取れないリスクがあるため注意が必要である。納付が難しい場合でも免除猶予制度や追納など選択肢があり放置よりも制度活用で将来リスクを下げることが重要となる。
219,相続,相続税申告・納付の期限として一般に正しいのはどれ？,被相続人の死亡を知った日の翌日から10か月以内,相続開始を知った日から3か月以内,相続開始から1年以内,いつでもよい,相続税の申告と納付は原則として被相続人の死亡を知った日の翌日から10か月以内に行う。期限内に遺産分割がまとまらない場合でも未分割のまま法定相続分で申告するなどの対応が必要となり期限を過ぎると延滞税や加算税の対象となり得る。相続放棄の熟慮期間とは別制度で期限も異なるため混同しないことが重要であり早期に財産債務の把握評価資料の収集を進めることが実務上の要点となる。
220,金融資産運用,債券投資の金利変動リスクに関する説明として正しいのはどれ？,一般に市場金利が上昇すると既発債券価格は下落しやすい,市場金利が上昇すると既発債券価格は必ず上昇する,金利が変動しても債券価格は絶対に変わらない,債券は株式より必ず価格変動が大きい,債券価格は市場金利と逆方向に動きやすい性質があり一般に市場金利が上昇すると既に発行されている低い利率の債券の相対的魅力が低下するため価格は下落しやすい。残存期間が長いほど価格変動が大きくなる傾向がありこれがデュレーションによる金利感応度の概念に繋がる。途中売却を想定する場合は利回りだけでなく金利変動時の価格リスクも踏まえて期間分散や投資目的の整理が重要となる。
221,タックスプランニング,住民税（個人住民税）に関する説明として正しいのはどれ？,住民税は所得割と均等割から構成される,住民税は国税で税率は全国一律である,住民税は消費税と同じく購入時に課税される,住民税は法人だけが支払う税金である,個人住民税は一般に「所得割」と「均等割」で構成される。所得割は前年の所得金額等を基礎に計算される税であり均等割は所得の多寡にかかわらず一定額が課される仕組みである。課税主体は都道府県・市町村であるため国税ではなく地方税に分類される。給与所得者は特別徴収（給与天引き）となることが多く前年所得に基づくため「今年の収入が減ったのに住民税が高い」と感じる要因にもなる。
222,リスク管理,損害保険の「免責金額」に関する説明として正しいのはどれ？,損害が発生したとき保険会社が支払わない自己負担額のこと,保険料を必ず半額にする制度のこと,事故が起きたら必ず全額補償される仕組みのこと,保険金を受け取るために必要な年齢条件のこと,免責金額は保険事故による損害が生じた場合に被保険者が自己負担する金額を指し保険金は通常「損害額?免責金額」で計算される。免責金額を設定すると小さな損害は自分で負担する代わりに保険料を抑えやすい一方で頻度の高い小損害には効果が薄くなる。契約時には「免責方式（一定額控除型など）」の形も確認し家計の負担可能額や事故頻度を踏まえて設計することが実務上重要である。
223,金融資産運用,投資信託の「分配金」に関する説明として正しいのはどれ？,分配金は投資信託の運用成果等から投資家に支払われ基準価額はその分だけ下がることがある,分配金が出る投資信託は必ず元本が増える,分配金は必ず利息として固定で支払われる,分配金はどの投資信託でも毎月必ず同額が出る,投資信託の分配金はファンドの運用状況や決算方針により支払われるが分配金が支払われるとその相当額だけ基準価額が下落するのが一般的であり「分配金＝利益の確定」とは限らない。分配金の原資が運用益だけでなく元本の一部取り崩し（特別分配金）となるケースもあるため分配金額の大小だけで良否を判断すると誤る。トータルリターン（分配金＋基準価額変動）で評価し再投資の有無や目的（取り崩し・長期形成）に合わせて商品を選ぶことが重要である。
224,相続,相続放棄の基本的な効果として正しいのはどれ？,相続放棄をすると最初から相続人でなかったものとみなされる,相続放棄をしても借金だけは必ず引き継ぐ,相続放棄は口頭で家族に伝えれば成立する,相続放棄をすると他の相続人の相続分が必ず減る,相続放棄は家庭裁判所への申述により行い受理されると「初めから相続人でなかった」ものと扱われるためプラスの財産だけでなく借金などのマイナス財産も原則として承継しない。単に家族内で放棄意思を示すだけでは法的効果は生じない点が重要である。放棄があると次順位の相続人に相続権が移るなど相続関係が変動するため関係者間での情報共有と期限管理（熟慮期間）を徹底し財産調査のうえで判断することが実務上の要点となる。
