ID,Category,Question,Choice1,Choice2,Choice3,Choice4,Explanation
304,相続,相続放棄について正しいのはどれ？,相続開始を知った日から原則3か月以内に家庭裁判所へ申述し受理されると初めから相続人でなかったことになる,口頭で親族に伝えればいつでも有効に放棄できる,相続放棄をしても被相続人の借金だけは相続する,相続放棄は一部の財産だけを選んで放棄できる,相続放棄は法律上の手続であり、原則として相続開始を知った日から3か月以内に家庭裁判所へ申述して受理される必要がある。受理されると、その人は初めから相続人でなかったものとして扱われ、プラスの財産だけでなく借金などマイナスの財産も引き継がない。一方で「借金だけ放棄」「特定の財産だけ相続」など都合よく一部だけを選ぶことはできない。判断を先延ばしにすると期限を過ぎるリスクがあるため、財産調査を含めて期限管理が重要になる。
305,リスク管理,生命保険の「保険料払込免除特約」の一般的な内容として最も適切なのはどれ？,所定の高度障害状態など一定の条件に該当した場合以後の保険料支払いが不要になり保障は継続する,契約から一定期間が経過すると誰でも保険料が無料になる,保険金を受け取った後でも必ず保険料を払い続けなければならない,保険料払込免除になると保障自体が消滅する,保険料払込免除特約は、契約者が所定の高度障害状態になるなど一定の免除事由に該当したとき、以後の保険料の支払いを不要としつつ契約の保障はそのまま継続させる仕組みである。ポイントは「保険料が免除される＝保障がなくなる」ではなく、保険料負担が難しくなった局面でも保障を維持しやすくする設計である点だ。免除事由は契約ごとに定められており、誰でも自動的に免除されるわけではない。保障内容と免除条件の両方を確認することが実務上の要点となる。
306,リスク管理,自動車保険の対人賠償責任保険について一般に正しい考え方はどれ？,重大事故では賠償額が高額化し得るため補償額を大きく設定するのが基本である,対人賠償は自賠責だけで常に十分なので任意保険は不要である,対人賠償は運転者本人のけがだけを補償する保険である,対人賠償は車の修理費だけを補償する,対人賠償責任保険は、交通事故で他人を死傷させた場合の損害賠償責任に備える保険であり、被害が大きいほど賠償額が高額になり得る。自賠責保険は最低限の補償に位置づけられ、実際の賠償がそれを上回る場面も想定されるため、任意保険で十分な補償額を確保するのが一般的なリスク管理となる。運転者自身のけがや車両損害は別の補償領域であり、対人賠償の対象は「相手方の人的損害」である点を押さえることが重要である。
307,タックスプランニング,源泉徴収制度について正しい説明はどれ？,給与などの支払者が税額を天引きして国に納付する仕組みである,納税者が必ず自分で税務署に現金を持参して納付する仕組みである,源泉徴収は住民税だけに適用され所得税には適用されない,源泉徴収がある場合は年末調整や確定申告は一切できない,源泉徴収は、給与や報酬などの支払者が、支払時点で所得税等を概算で差し引き（天引き）して納付することで、納税の機会を分散し徴収漏れを防ぐ仕組みである。納税者が都度納付する方式とは異なり、給与所得者の税負担が平準化される。なお、源泉徴収は概算であるため年末調整で過不足を精算することが多く、医療費控除など年末調整で完結しない控除がある場合は確定申告で調整する余地もある。「源泉徴収がある＝申告不可」ではない点が重要である。
308,タックスプランニング,年末調整で一般に精算できないため確定申告が必要になりやすいものはどれ？,医療費控除,扶養控除,配偶者控除,社会保険料控除,年末調整は会社が給与所得者の所得税を精算する仕組みだが、対象となる控除には範囲がある。扶養控除や配偶者控除、社会保険料控除などは年末調整で反映できる一方、医療費控除は原則として確定申告で適用する控除であり、支出額の集計や領収書管理など本人の手続が前提となる。したがって「年末調整があるから控除はすべて自動で適用される」と考えると誤りになりやすい。どの控除が年末調整で完結し、どれが確定申告が必要かを区別できることが実務上のポイントである。
309,不動産,建ぺい率の説明として正しいのはどれ？,敷地面積に対する建築面積の割合である,敷地面積に対する延べ床面積の割合である,建物の高さの上限を示す割合である,道路斜線制限の角度を示す割合である,建ぺい率は、敷地に対して建物をどの程度“建て詰め”できるかを示す指標で、敷地面積に対する建築面積（建物を真上から見たときの水平投影面積）の割合で表される。延べ床面積との比率は容積率であり、両者は混同しやすいが意味が異なる。建ぺい率は主に防災や日照・通風などの観点から、敷地内の空地を一定程度確保させる目的で規制される。したがって「建築面積／敷地面積」という定義を押さえることが重要である。
310,不動産,所有権移転登記について一般に正しい説明はどれ？,売主と買主が共同して申請するのが原則である,買主だけが単独で必ず申請しなければならない,売主だけが単独で必ず申請しなければならない,登記は義務ではなく申請しても所有者は変わらない,所有権移転登記は、不動産の権利変動を公示する手続で、原則として権利を失う側（売主）と取得する側（買主）が共同して申請する。これにより、真の権利者を外部から確認でき、第三者に対する対抗関係が明確になる。登記をしないと当事者間で売買が無効になるわけではないが、第三者に権利を主張できないなど実務上の不利益が生じ得るため重要である。したがって「共同申請が原則」「公示と対抗の役割が核心」という2点で理解するのが適切である。
311,ライフプランニング,キャッシュフロー表を作成する主な目的は？,将来の収支と貯蓄残高の推移を把握するため,資産運用の利回りを必ず高めるため,税金を必ずゼロにするため,保険料を必ず下げるため,キャッシュフロー表は現在から将来にわたる収入と支出と貯蓄残高の推移を時系列で見える化する資料である。教育費や住宅費や老後資金などの大きな支出時期と資金不足の可能性を事前に把握し対策を検討するために作成する。
312,ライフプランニング,必要保障額の考え方として最も適切なのは？,遺族の必要生活費から見込める収入を差し引いて算出する,保険料が最も安い金額に合わせて決める,世帯年収の10倍に必ず固定する,貯蓄額は考慮せず一律で決める,必要保障額は万一のとき遺族が必要とする資金を基準に考える。遺族の生活費や教育費など必要額を見積もり遺族年金や配偶者の収入や貯蓄などの見込める資金を差し引いて不足分を保険で準備するという考え方が基本である。
313,リスク管理,生命保険契約の告知義務とは？,健康状態や職業など重要事項を正しく告知する義務,保険会社が必ず契約を引き受ける義務,保険料を将来必ず据え置く義務,事故が起きる前に必ず解約する義務,告知義務は保険契約の申込み時などに被保険者等が健康状態や既往症や職業など引受判断に影響する重要事項を正確に告知する義務である。告知が不十分または事実と異なる場合は契約解除などの不利益が生じ得るため正しく行う必要がある。
314,リスク管理,地震が原因の火災損害に備える保険として一般的に適切なのは？,地震保険,自動車保険,傷害保険,個人賠償責任保険,地震を原因とする火災や損壊などは火災保険だけでは補償対象外となるのが一般的である。そのため地震による損害に備えるには地震保険でカバーするのが基本であり火災保険とセットで加入する仕組みになっている。
315,金融資産運用,複利運用の特徴として適切なのは？,利息にも利息が付くため運用期間が長いほど効果が大きい,元本にだけ利息が付く,運用期間が長いほど利息の効果は小さくなる,必ず元本割れしない,複利は元本だけでなく途中で得た利息も次期以降の運用元本に組み入れて利息が計算される。したがって時間が経つほど利息が増える土台が大きくなり長期ほど増え方が加速しやすいという性質がある。
316,金融資産運用,債券の表面利率とは何を表す？,額面金額に対する年間利息の割合,購入価格に対する利息と売買差益を含む割合,将来のインフレ率の見込み,発行体の格付けの高さ,表面利率は額面に対して毎年支払われる利息の割合を示す。購入価格が額面と異なる場合は実際の運用成果は変わるが表面利率自体は額面基準で固定されているため利回りとは区別して理解する。
317,タックスプランニング,所得税の税率構造として適切なのは？,超過累進税率,比例税率,逆進税率,定額税率,所得税は課税所得が増えるほど高い税率部分が適用される超過累進税率で計算される。所得全体に一律の税率を掛ける方式ではなく所得階層ごとに税率が段階的に上がる仕組みである。
318,タックスプランニング,住民税の所得割の標準税率として一般的に正しいのは？,一律10％,一律5％,超過累進税率,一律20％,住民税の所得割は原則として一律の税率で課税され標準税率は10％である。所得税のように段階的に税率が上がる仕組みではないため所得が増えても所得割の税率自体は基本的に一定である。
319,不動産,不動産の所有権移転を第三者に対抗するために必要なものは？,登記,契約書の保管,領収書の保管,近隣への口頭通知,不動産の物権変動は当事者間の合意で成立するが第三者に対抗するには原則として登記が必要である。登記がないと同じ不動産について第三者が権利を主張した場合に自分の取得を主張できないおそれがあるため対抗要件として登記が重要となる。
320,相続,配偶者と子2人が相続人の場合の法定相続分は？,配偶者2分の1で子は各4分の1,配偶者3分の2で子は各6分の1,配偶者4分の3で子は各8分の1,配偶者は全てで子は0,配偶者と子が相続人のとき配偶者の法定相続分は2分の1で子全体で2分の1となる。子が2人の場合は子の2分の1を均等に分けるため各子は4分の1ずつが法定相続分となる。
321,ライフプランニング,国民年金の第1号被保険者に該当するのはどれ？,自営業者や学生などで第2号第3号に該当しない20歳以上60歳未満の者,会社員や公務員,会社員や公務員に扶養される配偶者,65歳以上で老齢基礎年金を受給している者,国民年金の被保険者は第1号第2号第3号に区分される。第1号は自営業者や学生や無職などで厚生年金の加入者ではなく他者の扶養配偶者でもない20歳以上60歳未満の人が対象となる。会社員や公務員は第2号であり被扶養配偶者は第3号である。
322,リスク管理,保険価額より保険金額が低い契約は一般に何と呼ばれる？,一部保険,超過保険,重複保険,無効契約,保険価額は損害保険での対象物の価値をいい保険金額は契約で設定する上限額である。保険金額が保険価額より低い場合は一部保険となり損害が生じても損害額の全額が支払われず一定割合で支払われるなど補償が目減りする可能性がある。
323,金融資産運用,投資信託の基準価額を説明するものとして適切なのは？,純資産総額を総口数で割って算出した1口当たりの価額,運用会社の利益率を示す指標,必ず1日1回だけ一定額で固定される価格,分配金の金額そのもの,基準価額は投資信託の値段の目安であり信託財産の純資産総額を総口数で割って計算する。運用による株価や債券価格の変動や信託報酬などの影響で日々変動し分配金とは別概念である。
324,タックスプランニング,医療費控除の控除額を計算する際に差し引くものとして正しいのは？,保険金などで補填される金額,給与所得の源泉徴収税額,住民税の均等割,社会保険料の本人負担額,医療費控除は実際に支払った医療費のうち自己負担した部分を基に計算する。したがって入院給付金や高額療養費など保険金等で補填された金額は二重取りを防ぐため支払医療費から差し引く。さらに一定の自己負担限度として10万円または総所得金額等の5パーセントのいずれか低い方を差し引いた残額が控除対象となる。
325,不動産,固定資産税の納税義務者として原則正しいのは？,その年の1月1日時点で固定資産課税台帳に所有者として登録されている者,売買契約書に署名した者なら誰でも,不動産会社の仲介担当者,実際に居住している借主,固定資産税は地方税であり課税の基準日は原則として毎年1月1日である。基準日に固定資産課税台帳に所有者として登録されている人がその年度の納税義務者となる。売買や引渡しのタイミングと納税義務者が一致しないことがあるため実務では精算を取り決めることが多い。
326,相続,死亡保険金の相続税の非課税限度額として正しいのは？,500万円×法定相続人数,3000万円＋600万円×法定相続人数,1000万円×受取人の人数,一律500万円,相続税では一定の死亡保険金はみなし相続財産として課税対象になり得る一方で遺族の生活保障の観点から非課税枠が設けられている。非課税限度額は500万円に法定相続人数を掛けた金額でありこの範囲内の死亡保険金は相続税がかからない。
327,ライフプランニング,収入保障保険の一般的な特徴として適切なのは？,保障期間の経過とともに受取総額が逓減し保険料が割安になりやすい,満期まで受取額が一定で必ず増える,途中解約しても払込保険料は必ず全額戻る,医療費の自己負担額だけを補償する,収入保障保険は遺族の生活費を一定期間カバーする発想で設計されることが多く必要保障額が時間とともに減る家計に合わせやすい。一般に死亡時期が遅いほど受取期間が短くなるため受取総額が逓減し同じ保障規模の定期保険より保険料が抑えられる傾向がある。
328,リスク管理,自賠責保険の補償対象として正しいのは？,他人を死傷させた対人賠償のみ,自分の車の修理費,他人の車や物への対物賠償,運転者自身のけがの補償,自賠責保険は自動車損害賠償保障法に基づく強制保険で被害者救済を目的としている。そのため補償は原則として対人損害に限定され対物損害や自分の車の損害や運転者自身の傷害は補償されない。これらは任意保険で備えるのが一般的である。
329,金融資産運用,外貨預金の主なリスクとして適切なのは？,為替相場の変動により円換算の元本が増減する,必ず日本の預金保険制度で全額保護される,金利が必ずゼロになる,株式の配当が必ず受け取れる,外貨預金は外貨で運用するため満期時に円へ戻す場合などに為替レートの影響を受ける。預入時より円高になると円換算の受取額が減り元本割れとなることがある。金利だけでなく為替差損益も運用結果を左右する点が重要である。
330,タックスプランニング,所得控除と税額控除の違いとして適切なのは？,所得控除は課税所得を減らし税額控除は算出税額から直接差し引く,所得控除は税額から直接差し引き税額控除は課税所得を減らす,どちらも必ず同じ計算順序で同じ効果になる,税額控除は住民税にだけ適用され所得税には適用されない,所得控除は所得金額から差し引いて課税所得を小さくする仕組みで税率を掛ける前に効く。一方で税額控除は計算された税額から一定額を直接差し引くため同じ金額でも節税効果が分かりやすく大きくなりやすい。両者は控除のタイミングと効果の出方が異なるため区別して理解する必要がある。
331,ライフプランニング,老齢基礎年金の受給開始年齢（原則）は？,65歳,60歳,70歳,一律62歳,老齢基礎年金は国民年金の老齢給付であり原則として65歳から受給開始となる。繰上げ受給や繰下げ受給により開始年齢を変更できる制度はあるが「原則」の開始年齢は65歳であるため設問では65歳が正解となる。
332,リスク管理,地震による火災や損壊の損害をカバーする保険の考え方として適切なのは？,火災保険だけでは地震損害は原則補償されず地震保険の付帯が必要,火災保険は地震損害を自動的に全額補償する,自動車保険を付ければ建物の地震損害も補償される,生命保険を付ければ住宅の修理費が支払われる,地震が原因の火災や倒壊などの損害は火災保険の一般的な補償範囲から除外されているのが原則である。したがって地震による損害に備えるには火災保険に地震保険を付帯する形で契約する必要がある。補償の対象や支払限度も火災保険とは別枠で設計されている点が重要である。
333,金融資産運用,株価収益率（PER）の説明として適切なのは？,株価を1株当たり利益（EPS）で割った指標,1株当たり配当を株価で割った指標,株価を純資産で割った指標,企業の売上高を株数で割った指標,PERは株価が利益水準に対して割高か割安かをみる代表的な指標で株価÷EPSで計算する。配当利回りは配当÷株価でありPBRは株価÷1株当たり純資産であるため別指標である。PERは利益が変動すると数値も変わり同業比較などで目安として用いられる。
334,タックスプランニング,給与所得者が年末調整で適用を受けられず確定申告が必要になりやすいのはどれ？,医療費控除,社会保険料控除,配偶者控除,扶養控除,年末調整は勤務先が一定の所得控除を反映して税額を精算する仕組みだが医療費控除や寄附金控除などは原則として年末調整では処理できず本人が確定申告で適用を受ける必要がある。社会保険料控除や配偶者控除扶養控除は年末調整で反映されるのが一般的でありこの違いを押さえることが重要である。
335,不動産,建ぺい率の説明として正しいのは？,敷地面積に対する建築面積の割合,敷地面積に対する延べ床面積の割合,延べ床面積に対する建築面積の割合,建物の高さに対する敷地の幅の割合,建ぺい率は敷地に対して建物がどの程度の面積を占めるかを制限する指標で建築面積÷敷地面積で表す。延べ床面積を用いるのは容積率であり用途地域等の規制とあわせて建物規模を決める重要な基準となる。建築面積は通常1階部分の水平投影面積を指す点も押さえる。
336,相続,相続放棄の効果として適切なのは？,最初から相続人でなかったものとみなされる,借金だけを放棄して財産だけ相続できる,遺産分割協議後でもいつでも自由に撤回できる,相続税の申告期限が自動的に延長される,相続放棄は家庭裁判所への申述により行い受理されるとその人は初めから相続人でなかったものとして扱われる。したがってプラスの財産だけ相続しマイナスの財産だけ放棄するという選択はできない。また期限や手続があり撤回も原則として簡単にはできないため早期の判断と手続理解が重要である。
337,ライフプランニング,企業型確定拠出年金（企業型DC）の一般的な特徴として適切なのは？,掛金は原則として事業主が拠出し加入者が運用商品を選ぶ,掛金は必ず加入者が全額負担する,iDeCoと同じで誰でも必ず加入できる,運用成果に関係なく将来の受取額が確定している,企業型DCは企業が制度として導入し掛金は原則として事業主拠出である一方加入者が運用商品を選択し運用結果によって将来受け取る年金額が変動する。確定給付型と違い給付額は保証されない。加入対象はその企業の制度設計に基づくため誰でも加入できるわけではない点も重要である。
338,リスク管理,損害保険で同じ目的物に対して複数の保険契約を結ぶことを一般に何という？,重複保険,一部保険,超過保険,再保険,同一の目的物に対して同じ危険をカバーする契約が複数存在する状態を重複保険という。重複保険がある場合でも損害保険は実損填補が原則であり損害額を超えて保険金を受け取ることはできない。結果として各保険会社が負担割合に応じて支払うなど調整が行われるため契約内容の整理が重要である。
339,金融資産運用,分散投資の説明として適切なのは？,資産や地域や時間を分けて投資し価格変動リスクを抑える考え方,1つの銘柄に集中して期待収益を最大化する方法,必ず元本が保証される投資方法,投資期間を短くするほど必ず利益が出る方法,分散投資は価格変動や信用不安などの影響を一点集中にしないための基本戦略で資産クラス（株式債券不動産など）地域（国内外）時間（積立投資など）を分けて投資する。これにより特定要因による損失が全体に与える影響を小さくしリスクを平準化しやすくなる。分散しても損失がゼロになるわけではないがリスク管理の重要な手段である。
340,タックスプランニング,住民税の特徴として一般に正しいのは？,前年の所得を基に課税されるのが原則である,当年の所得が確定する前に当年分として課税される,所得税と同様に必ず年末調整で全て精算される,課税主体は国だけで地方自治体は関与しない,住民税は地方税であり原則として前年（1月1日から12月31日）の所得を基に翌年度に課税されるため所得税よりタイムラグがある。会社員は特別徴収で毎月天引きされることが多いがこれは納付方法の違いであり年末調整で住民税まで完全に精算する仕組みではない。課税主体は都道府県と市区町村である点もあわせて整理すると理解が安定する。
341,ライフプランニング,国民年金の第1号被保険者に該当するのは一般にどれ？,自営業者や学生などで会社員等ではない20歳以上60歳未満の人,会社員として厚生年金に加入している人,会社員に扶養されている配偶者（一定要件を満たす人）,75歳以上で後期高齢者医療制度の対象の人,国民年金は被保険者を第1号?第3号に区分する。第1号は自営業者・学生・無職など「会社員等（第2号）でも、その被扶養配偶者（第3号）でもない」20歳以上60歳未満の人が中心となる。会社員は厚生年金加入により第2号であり、その扶養配偶者は要件を満たせば第3号となるため区分を取り違えないことが重要である。
